{
  "$schema": "http://json-schema.org/draft-07/schema#",
  "title": "AshSemanticState",
  "description": "Aeostara semantic state bound to ASH.",
  "type": "object",
  "properties": {
    "ashSemanticStateID": {
      "type": "string"
    },
    "ashState": {
      "$ref": "AshState.schema.json"
    },
    "admissibilityResult": {
      "$ref": "AdmissibilityResult.schema.json"
    },
    "realmIdentity": {
      "$ref": "RealmIdentity.schema.json"
    },
    "diagnosticReference": {
      "$ref": "DiagnosticReference.schema.json"
    }
  },
  "required": [
    "ashSemanticStateID",
    "ashState",
    "admissibilityResult",
    "realmIdentity",
    "diagnosticReference"
  ],
  "additionalProperties": false
}
